[
  {"id":"src-java-language","title":"Java Language Specification, Java SE 21 Edition","url":"https://docs.oracle.com/javase/specs/jls/se21/html/","publisher":"Oracle","type":"specification"},
  {"id":"src-java-api","title":"Java SE 21 API Specification","url":"https://docs.oracle.com/en/java/javase/21/docs/api/","publisher":"Oracle","type":"official_documentation"},
  {"id":"src-jvm-spec","title":"Java Virtual Machine Specification, Java SE 21 Edition","url":"https://docs.oracle.com/javase/specs/jvms/se21/html/","publisher":"Oracle","type":"specification"},
  {"id":"src-openjdk-jeps","title":"JDK Enhancement Proposals","url":"https://openjdk.org/jeps/0","publisher":"OpenJDK","type":"official_documentation"},
  {"id":"src-openjdk-source","title":"OpenJDK JDK Source Code","url":"https://github.com/openjdk/jdk","publisher":"OpenJDK","type":"official_documentation"},
  {"id":"src-spring-framework","title":"Spring Framework Reference Documentation","url":"https://docs.spring.io/spring-framework/reference/","publisher":"Spring","type":"official_documentation"},
  {"id":"src-spring-boot","title":"Spring Boot Reference Documentation","url":"https://docs.spring.io/spring-boot/reference/","publisher":"Spring","type":"official_documentation"},
  {"id":"src-mysql","title":"MySQL 8.4 Reference Manual","url":"https://dev.mysql.com/doc/refman/8.4/en/","publisher":"Oracle","type":"official_documentation"},
  {"id":"src-redis","title":"Redis Documentation","url":"https://redis.io/docs/latest/","publisher":"Redis","type":"official_documentation"},
  {"id":"src-kafka","title":"Apache Kafka Documentation","url":"https://kafka.apache.org/documentation/","publisher":"Apache Software Foundation","type":"official_documentation"},
  {"id":"src-rabbitmq","title":"RabbitMQ Documentation","url":"https://www.rabbitmq.com/docs","publisher":"Broadcom","type":"official_documentation"},
  {"id":"src-microservices","title":"Microservices Architecture Style","url":"https://learn.microsoft.com/en-us/azure/architecture/guide/architecture-styles/microservices","publisher":"Microsoft","type":"official_guide"}
]
